{
  "packet_id": "toy_proof_packet_001",
  "schema_version": "toy.proof_packet.v1",
  "status": "noncanonical",
  "authority_ceiling": "candidate_only",
  "inputs": [
    {
      "id": "prior_tessera_fixture",
      "path": "fixtures/proofing/prior_tesserae.json",
      "synthetic": true,
      "notes": "Synthetic prior candidate material."
    },
    {
      "id": "candidate_tessera_fixture",
      "path": "fixtures/proofing/candidate_tesserae.json",
      "synthetic": true,
      "notes": "Synthetic candidate material with small drift."
    }
  ],
  "projections": [
    {
      "id": "prior_projection",
      "path": "sample_outputs/proofing_demo/prior_projection.json",
      "synthetic": true,
      "notes": "Toy projection generated by the public math demo."
    },
    {
      "id": "candidate_projection",
      "path": "sample_outputs/proofing_demo/candidate_projection.json",
      "synthetic": true,
      "notes": "Toy projection generated by the public math demo."
    }
  ],
  "manifests": [
    {
      "id": "prior_manifest",
      "path": "sample_outputs/proofing_demo/prior_manifest.json",
      "sha256": "44c60466338612583382b6905192996cf4a1d592cb43d1afda95d183dec6d392",
      "synthetic": true,
      "notes": "Synthetic manifest identity only; not truth."
    },
    {
      "id": "candidate_manifest",
      "path": "sample_outputs/proofing_demo/candidate_manifest.json",
      "sha256": "48e0db9e71fe542915babe0b0dec2ae2afcd1ff2ef8005716222e5418bf1ad2e",
      "synthetic": true,
      "notes": "Synthetic manifest identity only; not truth."
    }
  ],
  "receipt": {
    "id": "drift_receipt",
    "path": "sample_outputs/proofing_demo/drift_receipt.json",
    "sha256": "5e1e7f8ad383df28e9c2020c96c37ad784e4bac89efaa27fa41a9ffc17c61c56",
    "synthetic": true,
    "notes": "Synthetic evidence receipt; does not crown truth."
  },
  "gate_decision": {
    "decision": "hold_for_review",
    "reason": "Public packet cannot promote durable truth or claim private authority."
  },
  "boundary_assertions": {
    "contains_private_math": false,
    "contains_real_manifest_lineage": false,
    "contains_real_receipts": false,
    "contains_private_routing": false,
    "contains_runtime_authority": false,
    "contains_hardware_authority": false,
    "grants_implementation_rights": false
  }
}
